[
  {
    "id": "aluminum",
    "source": "physicallybased",
    "name": "Aluminum",
    "category": "metal",
    "tags": [],
    "source_url": "https://physicallybased.info",
    "source_license": "CC0-1.0",
    "available_tiers": [],
    "maps": [],
    "last_updated": "",
    "color_hex": "#EAEBEC",
    "roughness": 0,
    "metalness": 1,
    "ior": 1.5
  },
  {
    "id": "banana",
    "source": "physicallybased",
    "name": "Banana",
    "category": "organic",
    "tags": [],
    "source_url": "https://physicallybased.info",
    "source_license": "CC0-1.0",
    "available_tiers": [],
    "maps": [],
    "last_updated": "",
    "color_hex": "#A2881C",
    "roughness": 0.5,
    "metalness": 0,
    "ior": 1.5
  },
  {
    "id": "beryllium",
    "source": "physicallybased",
    "name": "Beryllium",
    "category": "metal",
    "tags": [],
    "source_url": "https://physicallybased.info",
    "source_license": "CC0-1.0",
    "available_tiers": [],
    "maps": [],
    "last_updated": "",
    "color_hex": "#898888",
    "roughness": 0,
    "metalness": 1,
    "ior": 1.5
  },
  {
    "id": "blackboard",
    "source": "physicallybased",
    "name": "Blackboard",
    "category": "other",
    "tags": [],
    "source_url": "https://physicallybased.info",
    "source_license": "CC0-1.0",
    "available_tiers": [],
    "maps": [],
    "last_updated": "",
    "color_hex": "#0A0A0A",
    "roughness": 0.9,
    "metalness": 0,
    "ior": 1.5
  },
  {
    "id": "blood",
    "source": "physicallybased",
    "name": "Blood",
    "category": "other",
    "tags": [],
    "source_url": "https://physicallybased.info",
    "source_license": "CC0-1.0",
    "available_tiers": [],
    "maps": [],
    "last_updated": "",
    "color_hex": "#A40101",
    "roughness": 0,
    "metalness": 0,
    "ior": 1.35
  },
  {
    "id": "bone",
    "source": "physicallybased",
    "name": "Bone",
    "category": "organic",
    "tags": [],
    "source_url": "https://physicallybased.info",
    "source_license": "CC0-1.0",
    "available_tiers": [],
    "maps": [],
    "last_updated": "",
    "color_hex": "#CACAA9",
    "roughness": 0.9,
    "metalness": 0,
    "ior": 1.5
  },
  {
    "id": "brass",
    "source": "physicallybased",
    "name": "Brass",
    "category": "metal",
    "tags": [],
    "source_url": "https://physicallybased.info",
    "source_license": "CC0-1.0",
    "available_tiers": [],
    "maps": [],
    "last_updated": "",
    "color_hex": "#E8C66C",
    "roughness": 0,
    "metalness": 1,
    "ior": 1.5
  },
  {
    "id": "brick",
    "source": "physicallybased",
    "name": "Brick",
    "category": "other",
    "tags": [],
    "source_url": "https://physicallybased.info",
    "source_license": "CC0-1.0",
    "available_tiers": [],
    "maps": [],
    "last_updated": "",
    "color_hex": "#431810",
    "roughness": 0.9,
    "metalness": 0,
    "ior": 1.5
  },
  {
    "id": "car_paint",
    "source": "physicallybased",
    "name": "Car Paint",
    "category": "other",
    "tags": [],
    "source_url": "https://physicallybased.info",
    "source_license": "CC0-1.0",
    "available_tiers": [],
    "maps": [],
    "last_updated": "",
    "color_hex": "#1A1A1A",
    "roughness": 0,
    "metalness": 0,
    "ior": 1.5
  },
  {
    "id": "carrot",
    "source": "physicallybased",
    "name": "Carrot",
    "category": "organic",
    "tags": [],
    "source_url": "https://physicallybased.info",
    "source_license": "CC0-1.0",
    "available_tiers": [],
    "maps": [],
    "last_updated": "",
    "color_hex": "#B62B07",
    "roughness": 0.5,
    "metalness": 0,
    "ior": 1.5
  },
  {
    "id": "cesium",
    "source": "physicallybased",
    "name": "Cesium",
    "category": "metal",
    "tags": [],
    "source_url": "https://physicallybased.info",
    "source_license": "CC0-1.0",
    "available_tiers": [],
    "maps": [],
    "last_updated": "",
    "color_hex": "#B78D3C",
    "roughness": 0,
    "metalness": 1,
    "ior": 1.5
  },
  {
    "id": "charcoal",
    "source": "physicallybased",
    "name": "Charcoal",
    "category": "organic",
    "tags": [],
    "source_url": "https://physicallybased.info",
    "source_license": "CC0-1.0",
    "available_tiers": [],
    "maps": [],
    "last_updated": "",
    "color_hex": "#050505",
    "roughness": 0.9,
    "metalness": 0,
    "ior": 1.5
  },
  {
    "id": "chocolate",
    "source": "physicallybased",
    "name": "Chocolate",
    "category": "organic",
    "tags": [],
    "source_url": "https://physicallybased.info",
    "source_license": "CC0-1.0",
    "available_tiers": [],
    "maps": [],
    "last_updated": "",
    "color_hex": "#29170F",
    "roughness": 0.5,
    "metalness": 0,
    "ior": 1.5
  },
  {
    "id": "chromium",
    "source": "physicallybased",
    "name": "Chromium",
    "category": "metal",
    "tags": [],
    "source_url": "https://physicallybased.info",
    "source_license": "CC0-1.0",
    "available_tiers": [],
    "maps": [],
    "last_updated": "",
    "color_hex": "#A7AFB3",
    "roughness": 0,
    "metalness": 1,
    "ior": 1.5
  },
  {
    "id": "cobalt",
    "source": "physicallybased",
    "name": "Cobalt",
    "category": "metal",
    "tags": [],
    "source_url": "https://physicallybased.info",
    "source_license": "CC0-1.0",
    "available_tiers": [],
    "maps": [],
    "last_updated": "",
    "color_hex": "#B2B4AB",
    "roughness": 0,
    "metalness": 1,
    "ior": 1.5
  },
  {
    "id": "coffee",
    "source": "physicallybased",
    "name": "Coffee",
    "category": "other",
    "tags": [],
    "source_url": "https://physicallybased.info",
    "source_license": "CC0-1.0",
    "available_tiers": [],
    "maps": [],
    "last_updated": "",
    "color_hex": "#722209",
    "roughness": 0,
    "metalness": 0,
    "ior": 1.34
  },
  {
    "id": "concrete",
    "source": "physicallybased",
    "name": "Concrete",
    "category": "other",
    "tags": [],
    "source_url": "https://physicallybased.info",
    "source_license": "CC0-1.0",
    "available_tiers": [],
    "maps": [],
    "last_updated": "",
    "color_hex": "#828282",
    "roughness": 0.5,
    "metalness": 0,
    "ior": 1.5
  },
  {
    "id": "cooking_oil",
    "source": "physicallybased",
    "name": "Cooking Oil",
    "category": "other",
    "tags": [],
    "source_url": "https://physicallybased.info",
    "source_license": "CC0-1.0",
    "available_tiers": [],
    "maps": [],
    "last_updated": "",
    "color_hex": "#BCAF17",
    "roughness": 0,
    "metalness": 0,
    "ior": 1.47
  },
  {
    "id": "copper",
    "source": "physicallybased",
    "name": "Copper",
    "category": "metal",
    "tags": [],
    "source_url": "https://physicallybased.info",
    "source_license": "CC0-1.0",
    "available_tiers": [],
    "maps": [],
    "last_updated": "",
    "color_hex": "#EE9F85",
    "roughness": 0,
    "metalness": 1,
    "ior": 1.5
  },
  {
    "id": "diamond",
    "source": "physicallybased",
    "name": "Diamond",
    "category": "glass",
    "tags": [],
    "source_url": "https://physicallybased.info",
    "source_license": "CC0-1.0",
    "available_tiers": [],
    "maps": [],
    "last_updated": "",
    "color_hex": "#FFFFFF",
    "roughness": 0,
    "metalness": 0,
    "ior": 2.4168
  },
  {
    "id": "egg_shell",
    "source": "physicallybased",
    "name": "Egg Shell",
    "category": "organic",
    "tags": [],
    "source_url": "https://physicallybased.info",
    "source_license": "CC0-1.0",
    "available_tiers": [],
    "maps": [],
    "last_updated": "",
    "color_hex": "#9C9FA1",
    "roughness": 0.9,
    "metalness": 0,
    "ior": 1.5
  },
  {
    "id": "eye_(cornea)",
    "source": "physicallybased",
    "name": "Eye (Cornea)",
    "category": "other",
    "tags": [],
    "source_url": "https://physicallybased.info",
    "source_license": "CC0-1.0",
    "available_tiers": [],
    "maps": [],
    "last_updated": "",
    "color_hex": "#FFFFFF",
    "roughness": 0,
    "metalness": 0,
    "ior": 1.376
  },
  {
    "id": "eye_(lens)",
    "source": "physicallybased",
    "name": "Eye (Lens)",
    "category": "other",
    "tags": [],
    "source_url": "https://physicallybased.info",
    "source_license": "CC0-1.0",
    "available_tiers": [],
    "maps": [],
    "last_updated": "",
    "color_hex": "#FFFFFF",
    "roughness": 0,
    "metalness": 0,
    "ior": 1.386
  },
  {
    "id": "eye_(sclera)",
    "source": "physicallybased",
    "name": "Eye (Sclera)",
    "category": "other",
    "tags": [],
    "source_url": "https://physicallybased.info",
    "source_license": "CC0-1.0",
    "available_tiers": [],
    "maps": [],
    "last_updated": "",
    "color_hex": "#A68064",
    "roughness": 0,
    "metalness": 0,
    "ior": 1.4
  },
  {
    "id": "gasoline",
    "source": "physicallybased",
    "name": "Gasoline",
    "category": "other",
    "tags": [],
    "source_url": "https://physicallybased.info",
    "source_license": "CC0-1.0",
    "available_tiers": [],
    "maps": [],
    "last_updated": "",
    "color_hex": "#FFF79D",
    "roughness": 0,
    "metalness": 0,
    "ior": 1.427
  },
  {
    "id": "germanium",
    "source": "physicallybased",
    "name": "Germanium",
    "category": "metal",
    "tags": [],
    "source_url": "https://physicallybased.info",
    "source_license": "CC0-1.0",
    "available_tiers": [],
    "maps": [],
    "last_updated": "",
    "color_hex": "#808477",
    "roughness": 0,
    "metalness": 1,
    "ior": 1.5
  },
  {
    "id": "glass",
    "source": "physicallybased",
    "name": "Glass",
    "category": "glass",
    "tags": [],
    "source_url": "https://physicallybased.info",
    "source_license": "CC0-1.0",
    "available_tiers": [],
    "maps": [],
    "last_updated": "",
    "color_hex": "#FFFFFF",
    "roughness": 0,
    "metalness": 0,
    "ior": 1.52
  },
  {
    "id": "gold",
    "source": "physicallybased",
    "name": "Gold",
    "category": "metal",
    "tags": [],
    "source_url": "https://physicallybased.info",
    "source_license": "CC0-1.0",